{
  "action": {
    "branch_effect": {
      "branch_ids": [],
      "coverage_evidence_id": null,
      "kind": "NONE"
    },
    "candidate_effect": {
      "candidate_id": null,
      "evidence_id": null,
      "kind": "NONE"
    },
    "dependencies": [
      "p0"
    ],
    "epistemic_effect": {
      "evidence_id": "e_verify",
      "to_status": "VERIFIED"
    },
    "goal_effect": {
      "goal_id": null,
      "kind": "NONE"
    },
    "id": "a0",
    "obligations_created": [],
    "obligations_discharged": [],
    "operation": "DERIVE",
    "output_id": "c1",
    "preconditions": [],
    "scope_effect": {
      "discharge_evidence_id": null,
      "kind": "NONE"
    },
    "summary": "(Indeed, we can check that $805 = 9\\cdot 89 + 4$.)",
    "typing": {
      "input_domains": {
        "p0": "Proposition"
      },
      "output_domain": "Proposition"
    },
    "warrant": {
      "evidence_id": "e_source",
      "kind": "EVIDENCE_ADAPTER",
      "rule": "SOURCE_REVIEWED_DERIVATION"
    }
  },
  "case_id": "SF-FINAL-EPI-005-B",
  "evidence": {
    "e_source": {
      "id": "e_source",
      "kind": "SOURCE_REVIEW",
      "premise_ids": [
        "p0"
      ],
      "source_span_hash": "9cf42a1cb0d6b891e463875041de5caec7825419dc689e7476f7641a8eb672a7",
      "status": "VALID",
      "supports_rule": "SOURCE_REVIEWED_DERIVATION",
      "trusted": true
    },
    "e_verify": {
      "id": "e_verify",
      "kind": "TRANSITION_CHECK",
      "premise_ids": [
        "p0"
      ],
      "status": "VALID",
      "supports_rule": "VERIFY_TRANSITION",
      "trusted": true
    }
  },
  "pair_id": "SF-FINAL-EPI-005",
  "schema_version": "semantic-firewall-case-0.1.0",
  "semantic_focus": "EPISTEMIC_STATUS",
  "source": {
    "category": "Number Theory",
    "dataset": "Hendrycks MATH train parquet",
    "gold125_overlap": false,
    "level": "Level 5",
    "problem": "What is the smallest positive multiple of $23$ that is $4$ more than a multiple of $89$?",
    "solution_span": "(Indeed, we can check that $805 = 9\\cdot 89 + 4$.)",
    "solution_span_hash": "9cf42a1cb0d6b891e463875041de5caec7825419dc689e7476f7641a8eb672a7",
    "source_hash": "9b33667f47bb02154f076f32ef3892f5066b8b95ce0fced7b0274c8c4a6a80a7",
    "source_role": "MATH context and exact worked-solution assertion anchoring an invariant-level transition probe",
    "source_row_id": "train-row-04731"
  },
  "split": "FINAL",
  "state_after": {
    "active_scopes": [
      "global"
    ],
    "branches": {},
    "candidates": {},
    "claims": {
      "c1": {
        "dependencies": [
          "p0"
        ],
        "domain": "Proposition",
        "id": "c1",
        "proposition": "(Indeed, we can check that $805 = 9\\cdot 89 + 4$.)",
        "scope": "global",
        "status": "VERIFIED"
      },
      "p0": {
        "dependencies": [],
        "domain": "Proposition",
        "id": "p0",
        "proposition": "What is the smallest positive multiple of $23$ that is $4$ more than a multiple of $89$?",
        "scope": "global",
        "status": "GIVEN"
      }
    },
    "goals": {},
    "obligations": {}
  },
  "state_before": {
    "active_scopes": [
      "global"
    ],
    "branches": {},
    "candidates": {},
    "claims": {
      "p0": {
        "dependencies": [],
        "domain": "Proposition",
        "id": "p0",
        "proposition": "What is the smallest positive multiple of $23$ that is $4$ more than a multiple of $89$?",
        "scope": "global",
        "status": "GIVEN"
      }
    },
    "goals": {},
    "obligations": {}
  }
}
