{
  "action": {
    "branch_effect": {
      "branch_ids": [],
      "coverage_evidence_id": null,
      "kind": "NONE"
    },
    "candidate_effect": {
      "candidate_id": null,
      "evidence_id": null,
      "kind": "NONE"
    },
    "dependencies": [
      "p0"
    ],
    "epistemic_effect": {
      "evidence_id": null,
      "to_status": "DERIVED"
    },
    "goal_effect": {
      "goal_id": null,
      "kind": "NONE"
    },
    "id": "a0",
    "obligations_created": [],
    "obligations_discharged": [],
    "operation": "DERIVE",
    "output_id": "c1",
    "preconditions": [
      {
        "deferable": false,
        "evidence_id": "e_pre",
        "id": "pre0",
        "obligation_id": null,
        "proposition": "The source operation's denominator/domain/sign condition holds.",
        "required": true,
        "status": "FAILED"
      }
    ],
    "scope_effect": {
      "discharge_evidence_id": null,
      "kind": "NONE"
    },
    "summary": "Then, $a + b = 25$, and since the $ab$ may be reduced to form $50$ on the denominator of $\\frac{27}{50}$, $50|ab$.",
    "typing": {
      "input_domains": {
        "p0": "Proposition"
      },
      "output_domain": "Proposition"
    },
    "warrant": {
      "evidence_id": "e_source",
      "kind": "EVIDENCE_ADAPTER",
      "rule": "SOURCE_REVIEWED_DERIVATION"
    }
  },
  "case_id": "SF-DEV-PRE-001-B",
  "evidence": {
    "e_pre": {
      "id": "e_pre",
      "kind": "PRECONDITION_CHECK",
      "premise_ids": [
        "p0"
      ],
      "status": "VALID",
      "supports_rule": "DOMAIN_CHECK",
      "trusted": true
    },
    "e_source": {
      "id": "e_source",
      "kind": "SOURCE_REVIEW",
      "premise_ids": [
        "p0"
      ],
      "source_span_hash": "e53d309172390e0186cc1fde9b07b4b44a51e121dc271b2a944bb1e1bd381e14",
      "status": "VALID",
      "supports_rule": "SOURCE_REVIEWED_DERIVATION",
      "trusted": true
    }
  },
  "pair_id": "SF-DEV-PRE-001",
  "schema_version": "semantic-firewall-case-0.1.0",
  "semantic_focus": "PRECONDITIONS",
  "source": {
    "category": "Number Theory",
    "dataset": "Hendrycks MATH train parquet",
    "gold125_overlap": true,
    "level": "Level 5",
    "problem": "Each of two boxes contains both black and white marbles, and the total number of marbles in the two boxes is $25.$ One marble is taken out of each box randomly. The probability that both marbles are black is $27/50,$ and the probability that both marbles are white is $m/n,$ where $m$ and $n$ are relatively prime positive integers. What is $m + n$?\n",
    "solution_span": "Then, $a + b = 25$, and since the $ab$ may be reduced to form $50$ on the denominator of $\\frac{27}{50}$, $50|ab$.",
    "solution_span_hash": "e53d309172390e0186cc1fde9b07b4b44a51e121dc271b2a944bb1e1bd381e14",
    "source_hash": "483bcd2dd6a24287ce1b9da076a5b0004787628acb08ff07a5e91170df3caeaa",
    "source_role": "MATH context and exact worked-solution assertion anchoring an invariant-level transition probe",
    "source_row_id": "train-row-05265"
  },
  "split": "DEV",
  "state_after": {
    "active_scopes": [
      "global"
    ],
    "branches": {},
    "candidates": {},
    "claims": {
      "c1": {
        "dependencies": [
          "p0"
        ],
        "domain": "Proposition",
        "id": "c1",
        "proposition": "Then, $a + b = 25$, and since the $ab$ may be reduced to form $50$ on the denominator of $\\frac{27}{50}$, $50|ab$.",
        "scope": "global",
        "status": "DERIVED"
      },
      "p0": {
        "dependencies": [],
        "domain": "Proposition",
        "id": "p0",
        "proposition": "Each of two boxes contains both black and white marbles, and the total number of marbles in the two boxes is $25.$ One marble is taken out of each box randomly. The probability that both marbles are black is $27/50,$ and the probability that both marbles are white is $m/n,$ where $m$ and $n$ are relatively prime positive integers. What is $m + n$?\n",
        "scope": "global",
        "status": "GIVEN"
      }
    },
    "goals": {},
    "obligations": {}
  },
  "state_before": {
    "active_scopes": [
      "global"
    ],
    "branches": {},
    "candidates": {},
    "claims": {
      "p0": {
        "dependencies": [],
        "domain": "Proposition",
        "id": "p0",
        "proposition": "Each of two boxes contains both black and white marbles, and the total number of marbles in the two boxes is $25.$ One marble is taken out of each box randomly. The probability that both marbles are black is $27/50,$ and the probability that both marbles are white is $m/n,$ where $m$ and $n$ are relatively prime positive integers. What is $m + n$?\n",
        "scope": "global",
        "status": "GIVEN"
      }
    },
    "goals": {},
    "obligations": {}
  }
}
