{
  "action": {
    "branch_effect": {
      "branch_ids": [],
      "coverage_evidence_id": null,
      "kind": "NONE"
    },
    "candidate_effect": {
      "candidate_id": null,
      "evidence_id": null,
      "kind": "NONE"
    },
    "dependencies": [
      "p0"
    ],
    "epistemic_effect": {
      "evidence_id": null,
      "to_status": "DERIVED"
    },
    "goal_effect": {
      "goal_id": null,
      "kind": "NONE"
    },
    "id": "a0",
    "obligations_created": [],
    "obligations_discharged": [],
    "operation": "DERIVE",
    "output_id": "c1",
    "preconditions": [
      {
        "deferable": false,
        "evidence_id": "e_pre",
        "id": "pre0",
        "obligation_id": null,
        "proposition": "The source operation's denominator/domain/sign condition holds.",
        "required": true,
        "status": "FAILED"
      }
    ],
    "scope_effect": {
      "discharge_evidence_id": null,
      "kind": "NONE"
    },
    "summary": "This is the denominator of our probability.",
    "typing": {
      "input_domains": {
        "p0": "Proposition"
      },
      "output_domain": "Proposition"
    },
    "warrant": {
      "evidence_id": "e_source",
      "kind": "EVIDENCE_ADAPTER",
      "rule": "SOURCE_REVIEWED_DERIVATION"
    }
  },
  "case_id": "SF-FINAL-PRE-008-A",
  "evidence": {
    "e_pre": {
      "id": "e_pre",
      "kind": "PRECONDITION_CHECK",
      "premise_ids": [
        "p0"
      ],
      "status": "VALID",
      "supports_rule": "DOMAIN_CHECK",
      "trusted": true
    },
    "e_source": {
      "id": "e_source",
      "kind": "SOURCE_REVIEW",
      "premise_ids": [
        "p0"
      ],
      "source_span_hash": "5db3f2cd80f549ff8e9054655fee7f99cf2330adc25e258d88e5e1526f77947a",
      "status": "VALID",
      "supports_rule": "SOURCE_REVIEWED_DERIVATION",
      "trusted": true
    }
  },
  "pair_id": "SF-FINAL-PRE-008",
  "schema_version": "semantic-firewall-case-0.1.0",
  "semantic_focus": "PRECONDITIONS",
  "source": {
    "category": "Counting & Probability",
    "dataset": "Hendrycks MATH train parquet",
    "gold125_overlap": false,
    "level": "Level 4",
    "problem": "A fair coin is tossed six times and the sequence of heads and tails is recorded. What is the probability that the sequence contains exactly two heads? Express your answer as a common fraction.",
    "solution_span": "This is the denominator of our probability.",
    "solution_span_hash": "5db3f2cd80f549ff8e9054655fee7f99cf2330adc25e258d88e5e1526f77947a",
    "source_hash": "3527f9956525b38a791bbd8470826b03daed00dba2c46018d6d273779c7e7044",
    "source_role": "MATH context and exact worked-solution assertion anchoring an invariant-level transition probe",
    "source_row_id": "train-row-01834"
  },
  "split": "FINAL",
  "state_after": {
    "active_scopes": [
      "global"
    ],
    "branches": {},
    "candidates": {},
    "claims": {
      "c1": {
        "dependencies": [
          "p0"
        ],
        "domain": "Proposition",
        "id": "c1",
        "proposition": "This is the denominator of our probability.",
        "scope": "global",
        "status": "DERIVED"
      },
      "p0": {
        "dependencies": [],
        "domain": "Proposition",
        "id": "p0",
        "proposition": "A fair coin is tossed six times and the sequence of heads and tails is recorded. What is the probability that the sequence contains exactly two heads? Express your answer as a common fraction.",
        "scope": "global",
        "status": "GIVEN"
      }
    },
    "goals": {},
    "obligations": {}
  },
  "state_before": {
    "active_scopes": [
      "global"
    ],
    "branches": {},
    "candidates": {},
    "claims": {
      "p0": {
        "dependencies": [],
        "domain": "Proposition",
        "id": "p0",
        "proposition": "A fair coin is tossed six times and the sequence of heads and tails is recorded. What is the probability that the sequence contains exactly two heads? Express your answer as a common fraction.",
        "scope": "global",
        "status": "GIVEN"
      }
    },
    "goals": {},
    "obligations": {}
  }
}
