{
  "action": {
    "branch_effect": {
      "branch_ids": [
        "b1",
        "b2"
      ],
      "coverage_evidence_id": "e_coverage",
      "kind": "JOIN"
    },
    "candidate_effect": {
      "candidate_id": null,
      "evidence_id": null,
      "kind": "NONE"
    },
    "dependencies": [
      "p0"
    ],
    "epistemic_effect": {
      "evidence_id": null,
      "to_status": "DERIVED"
    },
    "goal_effect": {
      "goal_id": null,
      "kind": "NONE"
    },
    "id": "a0",
    "obligations_created": [],
    "obligations_discharged": [],
    "operation": "JOIN_BRANCHES",
    "output_id": "c1",
    "preconditions": [],
    "scope_effect": {
      "discharge_evidence_id": null,
      "kind": "NONE"
    },
    "summary": "a = 0, b = 5: \\ & 2f(25) = [f(0)]^2 + [f(5)]^2\n\\end{align*}Case 1: $f(0) = 0$ and $f(1) = 0.$",
    "typing": {
      "input_domains": {
        "p0": "Proposition"
      },
      "output_domain": "Proposition"
    },
    "warrant": {
      "evidence_id": "e_source",
      "kind": "EVIDENCE_ADAPTER",
      "rule": "SOURCE_REVIEWED_DERIVATION"
    }
  },
  "case_id": "SF-FINAL-BRN-001-B",
  "evidence": {
    "e_coverage": {
      "branch_ids": [
        "b1",
        "b2"
      ],
      "id": "e_coverage",
      "kind": "EXHAUSTIVE_PARTITION",
      "premise_ids": [
        "p0"
      ],
      "status": "VALID",
      "supports_rule": "JOIN_BRANCHES",
      "trusted": true
    },
    "e_source": {
      "id": "e_source",
      "kind": "SOURCE_REVIEW",
      "premise_ids": [
        "p0"
      ],
      "source_span_hash": "2640246c56e1375f547dce299a68eff3debc4ed7401c7c0aa0c130079837b3d3",
      "status": "VALID",
      "supports_rule": "SOURCE_REVIEWED_DERIVATION",
      "trusted": true
    }
  },
  "pair_id": "SF-FINAL-BRN-001",
  "schema_version": "semantic-firewall-case-0.1.0",
  "semantic_focus": "BRANCH_JOIN",
  "source": {
    "category": "Intermediate Algebra",
    "dataset": "Hendrycks MATH train parquet",
    "gold125_overlap": false,
    "level": "Level 5",
    "problem": "Let $f$ be a function taking the nonnegative integers to the nonnegative integers, such that\n\\[2f(a^2 + b^2) = [f(a)]^2 + [f(b)]^2\\]for all nonnegative integers $a$ and $b.$\n\nLet $n$ be the number of possible values of $f(25),$ and let $s$ be the sum of the possible values of $f(25).$  Find $n \\times s.$",
    "solution_span": "a = 0, b = 5: \\ & 2f(25) = [f(0)]^2 + [f(5)]^2\n\\end{align*}Case 1: $f(0) = 0$ and $f(1) = 0.$",
    "solution_span_hash": "2640246c56e1375f547dce299a68eff3debc4ed7401c7c0aa0c130079837b3d3",
    "source_hash": "970523a400b490ed32a76523fab3dd3756fa1f50154d12b89e16e6a8a23459c2",
    "source_role": "MATH context and exact worked-solution assertion anchoring an invariant-level transition probe",
    "source_row_id": "train-row-03488"
  },
  "split": "FINAL",
  "state_after": {
    "active_scopes": [
      "global"
    ],
    "branches": {
      "b1": {
        "conclusion": "a = 0, b = 5: \\ & 2f(25) = [f(0)]^2 + [f(5)]^2\n\\end{align*}Case 1: $f(0) = 0$ and $f(1) = 0.$",
        "id": "b1",
        "predicate": "case one",
        "status": "CLOSED"
      },
      "b2": {
        "conclusion": "a = 0, b = 5: \\ & 2f(25) = [f(0)]^2 + [f(5)]^2\n\\end{align*}Case 1: $f(0) = 0$ and $f(1) = 0.$",
        "id": "b2",
        "predicate": "case two",
        "status": "CLOSED"
      }
    },
    "candidates": {},
    "claims": {
      "c1": {
        "dependencies": [
          "p0"
        ],
        "domain": "Proposition",
        "id": "c1",
        "proposition": "a = 0, b = 5: \\ & 2f(25) = [f(0)]^2 + [f(5)]^2\n\\end{align*}Case 1: $f(0) = 0$ and $f(1) = 0.$",
        "scope": "global",
        "status": "DERIVED"
      },
      "p0": {
        "dependencies": [],
        "domain": "Proposition",
        "id": "p0",
        "proposition": "Let $f$ be a function taking the nonnegative integers to the nonnegative integers, such that\n\\[2f(a^2 + b^2) = [f(a)]^2 + [f(b)]^2\\]for all nonnegative integers $a$ and $b.$\n\nLet $n$ be the number of possible values of $f(25),$ and let $s$ be the sum of the possible values of $f(25).$  Find $n \\times s.$",
        "scope": "global",
        "status": "GIVEN"
      }
    },
    "goals": {},
    "obligations": {}
  },
  "state_before": {
    "active_scopes": [
      "global"
    ],
    "branches": {
      "b1": {
        "conclusion": "a = 0, b = 5: \\ & 2f(25) = [f(0)]^2 + [f(5)]^2\n\\end{align*}Case 1: $f(0) = 0$ and $f(1) = 0.$",
        "id": "b1",
        "predicate": "case one",
        "status": "CLOSED"
      },
      "b2": {
        "conclusion": "a = 0, b = 5: \\ & 2f(25) = [f(0)]^2 + [f(5)]^2\n\\end{align*}Case 1: $f(0) = 0$ and $f(1) = 0.$",
        "id": "b2",
        "predicate": "case two",
        "status": "CLOSED"
      }
    },
    "candidates": {},
    "claims": {
      "p0": {
        "dependencies": [],
        "domain": "Proposition",
        "id": "p0",
        "proposition": "Let $f$ be a function taking the nonnegative integers to the nonnegative integers, such that\n\\[2f(a^2 + b^2) = [f(a)]^2 + [f(b)]^2\\]for all nonnegative integers $a$ and $b.$\n\nLet $n$ be the number of possible values of $f(25),$ and let $s$ be the sum of the possible values of $f(25).$  Find $n \\times s.$",
        "scope": "global",
        "status": "GIVEN"
      }
    },
    "goals": {},
    "obligations": {}
  }
}
