{
  "action": {
    "branch_effect": {
      "branch_ids": [],
      "coverage_evidence_id": null,
      "kind": "NONE"
    },
    "candidate_effect": {
      "candidate_id": "cand1",
      "evidence_id": "missing_candidate_check",
      "kind": "PROMOTE"
    },
    "dependencies": [
      "p0"
    ],
    "epistemic_effect": {
      "evidence_id": null,
      "to_status": "DERIVED"
    },
    "goal_effect": {
      "goal_id": null,
      "kind": "NONE"
    },
    "id": "a0",
    "obligations_created": [],
    "obligations_discharged": [],
    "operation": "VERIFY_CANDIDATE",
    "output_id": "c1",
    "preconditions": [],
    "scope_effect": {
      "discharge_evidence_id": null,
      "kind": "NONE"
    },
    "summary": "\\end{align*}The smallest possible value for $A$ is 1, which gives us $21=3b+3$ and $b=6$.",
    "typing": {
      "input_domains": {
        "p0": "Proposition"
      },
      "output_domain": "Proposition"
    },
    "warrant": {
      "evidence_id": "e_source",
      "kind": "EVIDENCE_ADAPTER",
      "rule": "SOURCE_REVIEWED_DERIVATION"
    }
  },
  "case_id": "SF-FINAL-CAN-006-B",
  "evidence": {
    "e_candidate": {
      "candidate_id": "cand1",
      "checked_constraints": [
        "p0"
      ],
      "id": "e_candidate",
      "kind": "CANDIDATE_CHECK",
      "premise_ids": [
        "p0"
      ],
      "status": "VALID",
      "supports_rule": "VERIFY_CANDIDATE",
      "trusted": true
    },
    "e_source": {
      "id": "e_source",
      "kind": "SOURCE_REVIEW",
      "premise_ids": [
        "p0"
      ],
      "source_span_hash": "6af3bbd230d0404852cd0b7f9c23064901e29740094d1b3ce86ce83aa4babaa6",
      "status": "VALID",
      "supports_rule": "SOURCE_REVIEWED_DERIVATION",
      "trusted": true
    }
  },
  "pair_id": "SF-FINAL-CAN-006",
  "schema_version": "semantic-firewall-case-0.1.0",
  "semantic_focus": "CANDIDATES",
  "source": {
    "category": "Number Theory",
    "dataset": "Hendrycks MATH train parquet",
    "gold125_overlap": false,
    "level": "Level 4",
    "problem": "If $AAA_4$ can be expressed as $33_b$, where $A$ is a digit in base 4 and $b$ is a base greater than 5, what is the smallest possible sum $A+b$?",
    "solution_span": "\\end{align*}The smallest possible value for $A$ is 1, which gives us $21=3b+3$ and $b=6$.",
    "solution_span_hash": "6af3bbd230d0404852cd0b7f9c23064901e29740094d1b3ce86ce83aa4babaa6",
    "source_hash": "b0d90746e5298aa1a4ad9394a6d3783c4010ece23072b01610f28f53d8f32db7",
    "source_role": "MATH context and exact worked-solution assertion anchoring an invariant-level transition probe",
    "source_row_id": "train-row-04680"
  },
  "split": "FINAL",
  "state_after": {
    "active_scopes": [
      "global"
    ],
    "branches": {},
    "candidates": {
      "cand1": {
        "constraint_ids": [
          "p0"
        ],
        "id": "cand1",
        "proposition": "\\end{align*}The smallest possible value for $A$ is 1, which gives us $21=3b+3$ and $b=6$.",
        "scope": "global",
        "status": "VERIFIED"
      }
    },
    "claims": {
      "c1": {
        "dependencies": [
          "p0"
        ],
        "domain": "Proposition",
        "id": "c1",
        "proposition": "\\end{align*}The smallest possible value for $A$ is 1, which gives us $21=3b+3$ and $b=6$.",
        "scope": "global",
        "status": "DERIVED"
      },
      "p0": {
        "dependencies": [],
        "domain": "Proposition",
        "id": "p0",
        "proposition": "If $AAA_4$ can be expressed as $33_b$, where $A$ is a digit in base 4 and $b$ is a base greater than 5, what is the smallest possible sum $A+b$?",
        "scope": "global",
        "status": "GIVEN"
      }
    },
    "goals": {},
    "obligations": {}
  },
  "state_before": {
    "active_scopes": [
      "global"
    ],
    "branches": {},
    "candidates": {
      "cand1": {
        "constraint_ids": [
          "p0"
        ],
        "id": "cand1",
        "proposition": "\\end{align*}The smallest possible value for $A$ is 1, which gives us $21=3b+3$ and $b=6$.",
        "scope": "global",
        "status": "PROPOSED"
      }
    },
    "claims": {
      "p0": {
        "dependencies": [],
        "domain": "Proposition",
        "id": "p0",
        "proposition": "If $AAA_4$ can be expressed as $33_b$, where $A$ is a digit in base 4 and $b$ is a base greater than 5, what is the smallest possible sum $A+b$?",
        "scope": "global",
        "status": "GIVEN"
      }
    },
    "goals": {},
    "obligations": {}
  }
}
